Company;Model;Date;User;Rating;Usage;Review
BMW;3Series;2 Feb 2020;The 997;4.3; Family Car | Occasional Commute | Daily Commute | Tours ;It's really good at everything other than maintenance, which is really expensive. if you can afford it, it's really the only car you ever need...
BMW;3Series;29 Nov 2020;Avinash Gupta;5.0; Daily Commute | Occasional Commute;Awesome features with luxury feeling. Have great mileage and in good condition. It also have large space in back
BMW;3Series;14 Jun 2020;Rohit Banerjee;4.3; Family Car | Occasional Commute ;Wonderful car, no doubt in it. But in Kolkata, the after sale service is very very poor.
BMW;3Series;28 Jul 2020;Anil Patil;4.0; Occasional Commute | Family Car | Tours;awesome vehicle , only on a high maintenance side, status car.
BMW;3Series;27 Jun 2020;Sr Creation;4.3; Family Car ;Nice car love it by its performance and all the thing
BMW;3Series;13 May 2020;Ian Clements;5.0; Family Car;Great for family as I have the tourer version
BMW;3Series;29 Dec 2020;Naga Don;4.3; Family Car;it's very good comfort and driving control
BMW;3Series;24 Dec 2019;Vishal Kumar;5.0; Occasional Commute ;great car great features value for money
