Company;Model;Date;User;Rating;Usage;Review
MarutiSuzuki;Ritz;20 Jan 2019;Nidhish K;4.3; Daily Commute | Occasional Commute | Family Car | Tours ;Good car for everyone, good comfort but engine performance is bad in hill areas
MarutiSuzuki;Ritz;18 Jun 2019;Imran Kareem;4.3; Family Car ;Superb hatch back nice sporty model powerful turbocharger totally ultimate
MarutiSuzuki;Ritz;27 Jan 2019;Lalremsanga ..;4.3; Occasional Commute;Good on highways. Not happy with the ground clearance. Wheel size must be 16
MarutiSuzuki;Ritz;31 Oct 2018;Nabeel Najeeb;4.3; Occasional Commute ;best in class segment.good featurtes and best i mileage within town areas
MarutiSuzuki;Ritz;12 Jul 2019;NARAYANA BHAT;4.7; Family Car ;Very nice riding experience - sad that Maruti stopped Ritz production.
MarutiSuzuki;Ritz;7 Jan 2019;Asif Pk;3.3; Family Car ;Stearing is very hard ,and gear changing is risky in certain situations
MarutiSuzuki;Ritz;25 Jul 2019;Anil Tadagalale;3.0; Daily Commute | Family Car | Tours ;It is fun very good performance and good milage even at high speeds
MarutiSuzuki;Ritz;3 Apr 2019;Dharshan Bapu;3.0; Daily Commute ;Its a cool car with good leg space and right one for tall people....
MarutiSuzuki;Ritz;13 May 2019;Shiva Kumar;4.7; Daily Commute | Family Car | Tours ;It is an excellent car better than so many other cars of its class.
MarutiSuzuki;Ritz;13 Apr 2019;Dr Arun;2.0; Occasional Commute ;Average satisfaction , mileage is good but engine not going smooth.
MarutiSuzuki;Ritz;7 Apr 2019;Nitesh Deshwar;4.7; Daily Commute ;A very nice car, but bad news is that maruti discontinued this car.
MarutiSuzuki;Ritz;2 Jan 2019;Chopra Tushar;5.0; Family Car ;I have the best experience in all my cars i had previously bought
MarutiSuzuki;Ritz;9 Feb 2019;Kinley Drukpa;5.0; Family Car ;Ritz was an economic efficient and comfortable car at my level.
MarutiSuzuki;Ritz;3 Aug 2019;Kantha Veera;3.3; Daily Commute ;Its best hatch back car for middle class people
MarutiSuzuki;Ritz;17 Jan 2019;Balavva Chin..;5.0; Family Car ;Awesome family member car, its with me from last 6 years
MarutiSuzuki;Ritz;25 Mar 2019;Jeevan Kumar;5.0; Family Car ;Nice compact design with all the comforts for all ages
MarutiSuzuki;Ritz;19 Jan 2019;Amit Kumar;3.7; Daily Commute ;nice to drive but without safety and other new featues
MarutiSuzuki;Ritz;16 Apr 2019;Sunilkumar Sr;5.0; Daily Commute | Occasional Commute | Family Car | Tours ;good vehicle with mileage, seating is comfortable.
MarutiSuzuki;Ritz;21 Mar 2019;Pikku Vaava;5.0; Family Car ;My all time favorite car with all over performance
MarutiSuzuki;Ritz;23 Jul 2018;Mahee M;4.3; Daily Commute ;Firstly, it has good height and it gives comfort .
MarutiSuzuki;Ritz;16 Feb 2019;Yash Pal;4.7; Family Car ;WONDERFUL Family car it is. Really nice invention
MarutiSuzuki;Ritz;22 May 2019;Rakesh Raman..;2.7; Occasional Commute | Family Car ;Good for small family. Old or outdated features.
MarutiSuzuki;Ritz;18 Apr 2019;Anil Kumar;3.3; Family Car ;Overall nice experience.. Stable on highways..
MarutiSuzuki;Ritz;9 Mar 2019;K Sanmath;4.3; Daily Commute | Family Car ;Good car , comfortable to drive and long rides
MarutiSuzuki;Ritz;9 Oct 2018;Mann Bhimber;4.7; Daily Commute ;Most economical car ever produced by maruti ..
MarutiSuzuki;Ritz;21 Jul 2019;RAJASEKHAR P..;5.0; Daily Commute | Family Car | Tours ;The Best Family Car. Low Maintenance Cost.
MarutiSuzuki;Ritz;2 Aug 2019;Ashis Acharya;4.3; Family Car ;Best for Traveling with high speed
MarutiSuzuki;Ritz;11 Jul 2019;CRAZY MALLU;4.0; Daily Commute | Family Car ;Very good vehicle and also nice performance
MarutiSuzuki;Ritz;18 Oct 2018;Albin Don;2.7; Family Car ;Good family vehicle by maruti suzuki.......
MarutiSuzuki;Ritz;20 Oct 2018;Sandeep Talwar;3.3; Daily Commute | Family Car ;Good one I love Ritz it"s very comfortable
MarutiSuzuki;Ritz;18 May 2019;Shobha Bhatt..;4.3; Family Car ;Comfortable,easy to drive,hassle free car
MarutiSuzuki;Ritz;15 Mar 2019;Mooninder Singh;3.7; Daily Commute | Family Car ;It's simply good even better than swift
MarutiSuzuki;Ritz;1 Jan 2019;Ashish Shah;4.7; Family Car ;good driving experience with safety too
MarutiSuzuki;Ritz;13 Mar 2019;Rahul Mahesh..;4.0; Tours ;Good road grip and power excellent car
MarutiSuzuki;Ritz;13 Feb 2019;Shiv Sharma;3.7; Family Car ;Good in drive overall great experience
MarutiSuzuki;Ritz;24 Feb 2019;Harsh Vardhan;4.3; Daily Commute ;It is a good choice for daily up-down
MarutiSuzuki;Ritz;27 Sep 2018;0;5.0; Daily Commute | Family Car ;Best in class vehicle i miss that one
MarutiSuzuki;Ritz;11 Feb 2019;Ram Bhardwaj;3.7; Family Car ;Good car but ritz do not have safety
MarutiSuzuki;Ritz;1 Jul 2019;Vinod Patel;3.3; Daily Commute ;Low average and low maintenance.
MarutiSuzuki;Ritz;18 May 2019;Chandradeep ..;5.0; Daily Commute ;As of now I never faced any trouble
MarutiSuzuki;Ritz;5 Feb 2019;Siva Shankar;2.3; Family Car ;Super maintenance and excellent car
MarutiSuzuki;Ritz;22 Feb 2019;Krishna Kant;4.7; Tours ;It's reliable car with confidence.
MarutiSuzuki;Ritz;13 Apr 2019;Shabbir Ali;5.0; Daily Commute ;Very comfortable and good mileage
MarutiSuzuki;Ritz;14 Dec 2018;Tlan Sanga;4.0; Family Car ;Looks good and engine is powerful
MarutiSuzuki;Ritz;16 Oct 2018;Listin John;3.7; Family Car ;Good car for a small family......
MarutiSuzuki;Ritz;14 Jul 2019;Ajesh Johnson;4.7; Family Car ;Safe ride, good for Family use
MarutiSuzuki;Ritz;7 Jan 2019;Anthony Moraes;2.7; Occasional Commute ;Not happy with the front view.
MarutiSuzuki;Ritz;19 Nov 2018;Neeraj Aggarwal;5.0; Family Car ;Good car, no problem at all
MarutiSuzuki;Ritz;21 Sep 2018;Santosh Kanthi;3.0; Daily Commute ;Very good and comfortable
MarutiSuzuki;Ritz;4 Sep 2018;Krishna Chai..;5.0; Family Car ;Its my lovely car....
MarutiSuzuki;Ritz;28 Jan 2019;Somnath Mitra;3.0; Family Car ;Good but not better
MarutiSuzuki;Ritz;22 Nov 2018;Shekar Kokku;5.0; Tours ;Superb car.
MarutiSuzuki;Ritz;12 Dec 2018;Sanjay Singh;4.3; Family Car ;Good
