Company;Model;Date;User;Rating;Usage;Review
Toyota;InnovaCrysta20162020;27 Jun 2019;Amod Agrawal;4.7; Daily Commute;A very comfortable car for daily use.
Toyota;InnovaCrysta20162020;3 Mar 2019;Md Wasim;2.3; Occasional Commute ;Good car overall good but cost is high
Toyota;InnovaCrysta20162020;29 Jul 2019;Gafoor Malay..;3.0; Family Car ;good experience & comfort travel
Toyota;InnovaCrysta20162020;3 Apr 2019;Ghouse Ahmed;3.0; Family Car ;Best car for family and long journeys
Toyota;InnovaCrysta20162020;5 Mar 2019;Venkeatesh K..;4.7; Tours ;Nice car very good l love Toyota cars
Toyota;InnovaCrysta20162020;12 Jan 2019;Nafees Ali;4.0; Family Car ;best car fabulous car i like this car
Toyota;InnovaCrysta20162020;1 Oct 2018;Anju John;5.0; Occasional Commute | Family Car ;Its overall excellent. i love the car
Toyota;InnovaCrysta20162020;25 Apr 2019;Rituraj 1981;5.0; Daily Commute | Tours | Occasional Commute | Family Car ;it is safe and best car in the world
Toyota;InnovaCrysta20162020;10 Apr 2019;Shaik Farooq;5.0; Family Car ;Good for family it's like a mini bus
Toyota;InnovaCrysta20162020;26 Dec 2018;Harshavardha..;1.7; Family Car ;It is in good condition and very big
Toyota;InnovaCrysta20162020;2 Nov 2018;Niranjan Bha..;4.7; Occasional Commute ;Very comfortable for purchased a car
Toyota;InnovaCrysta20162020;24 Jul 2019;Gajendrakuma..;2.7; Tours | Occasional Commute | Family Car ;Not upto the mark of German cars
Toyota;InnovaCrysta20162020;21 Jun 2019;Amit Bagiyal;5.0; Daily Commute | Tours | Occasional Commute | Family Car ;excellent vehicle for all purposes
Toyota;InnovaCrysta20162020;28 May 2019;Mr EnTerTaiN..;2.3; Occasional Commute ;good only for taxi tours and travel
Toyota;InnovaCrysta20162020;10 Mar 2019;Neer Dayma;4.7; Tours | Family Car ;Good but plastic quality is average
Toyota;InnovaCrysta20162020;6 Feb 2019;Abhijit Sank..;4.0; Family Car ;Nice for family safe also..........
Toyota;InnovaCrysta20162020;2 Jul 2019;Sumanth Ecmas;4.7; Daily Commute | Family Car ;its looks good and safe,reliable
Toyota;InnovaCrysta20162020;2 Mar 2019;J GANESH;4.7; Family Car ;Very nice, good comfortable car
Toyota;InnovaCrysta20162020;19 Feb 2019;Anchal Singh;5.0; Daily Commute | Tours | Occasional Commute | Family Car ;Innova Crysta was wonderful SUV
Toyota;InnovaCrysta20162020;5 Feb 2019;Ramakanth Na..;5.0; Family Car ;Nice good engine and nice shape
Toyota;InnovaCrysta20162020;4 Jul 2019;Ikram Ahmad;5.0; Daily Commute | Tours | Occasional Commute | Family Car ;Excellent great car in India
Toyota;InnovaCrysta20162020;25 Jan 2019;Mujeeb Rahaman;5.0; Family Car ;Thanks innova and Toyota motor
Toyota;InnovaCrysta20162020;20 Jan 2019;Vishal Shetty;5.0; Daily Commute ;Cheapest big car :"
Toyota;InnovaCrysta20162020;23 Aug 2018;Supriymay Ma..;4.0; Family Car;Bumper price
Toyota;InnovaCrysta20162020;29 Dec 2018;Nazer Moyottil;4.0; Family Car ;Very good
Toyota;InnovaCrysta20162020;4 Sep 2018;Anand Kumar;4.3; Family Car ;brilliant
Toyota;InnovaCrysta20162020;13 Aug 2018;Anand Singh;3.7; Tours ;Good
